{
  "schema_version": "1.0.0",
  "observation_id": "obs_6f80a42371d377b212f45c4aa305609c",
  "run_id": "run_20261010_eval_multimodal_v1",
  "model": {
    "name": "multimodal_evidence_fusion",
    "version": "1.0.0",
    "modality": "multimodal_fusion",
    "execution_hardware": "cpu",
    "latency_ms": 15.4
  },
  "status": "success",
  "created_at": "2026-10-10T23:50:45Z",
  "result": {
    "final_verdict": {
      "classification": "phishing",
      "confidence_score": 0.965,
      "is_phishing": true,
      "threat_level": "critical"
    },
    "targeted_brand_consensus": {
      "identified_brand": "1&1 Ionos",
      "confidence": 0.942,
      "cross_modal_agreement": true
    },
    "identity_conflict_assessment": {
      "claimed_brand": "1&1 Ionos",
      "actual_registered_domain": "serv-acamai.com",
      "is_authorized_domain": false,
      "brand_domain_mismatch_detected": true
    },
    "evidence_summary": {
      "supporting_evidence": [
        {
          "modality": "computer_vision",
          "description": "Visual logo matched '1&1 Ionos' with 94.2% similarity score.",
          "weight_contribution": 0.40
        },
        {
          "modality": "url",
          "description": "Hostname 'serv-acamai.com' lacks authority for '1&1 Ionos'.",
          "weight_contribution": 0.35
        },
        {
          "modality": "html_nlp",
          "description": "Credential harvesting form detected on unauthorized host.",
          "weight_contribution": 0.25
        }
      ],
      "conflicting_evidence": [],
      "active_modalities": ["url", "html_nlp", "ocr", "computer_vision"],
      "omitted_modalities": []
    }
  },
  "warnings": [],
  "error_details": null
}
